product_group,technical_details
CARRETILHA VIZEL AIR,Chassi em alumínio | Drag 5.5kg | Recolhimento 7.0:1 | 9 rolamentos | Manivela com infinito anti-reverso
MOLINETE TARGUS,Chassi em grafite | Carretel em alumínio | 3 rolamentos | Sistema balanceado | Capacidade de linha 0.25mm/100m
VARA TRIGGER,Vara para carretilha | 1.68m | Ação rápida | Linha de 8-17lb | Passadores em óxido de alumínio
ISCAS ARTIFICIAIS YARA,Isca flutuante | Corpo rígido | Garateias reforçadas | Ideal para traíras e tucunarés | Tamanho 9cm
LINHA MONOFILAMENTO,Linha de pesca monofilamento | Diâmetro 0.30mm | Resistência 14lb | Carretel com 300m | Cor verde
ALICATE DE CONTENÇÃO,Alicate em aço inox | Cabo anatômico | Trava de segurança | Ideal para contenção de peixes
BOIA TORPEDO,Boia torpedo 25g | Flutuação média | Ideal para pesca de superfície | Cor vermelha e branca
ANZOL MARINE SPORT,Anzol tipo Maruseigo | Tamanho 2/0 | Aço niquelado | Super resistente | Pacote com 10 unidades
